{
  "verified": false,
  "officeOfReadings": {
    "psalmody": [
      {
        "type": "psalm",
        "ref": "Ps 3"
      },
      {
        "type": "psalm",
        "ref": "Ps 4"
      },
      {
        "type": "psalm",
        "ref": "Ps 5"
      }
    ]
  },
  "lauds": {
    "psalmody": [
      {
        "type": "psalm",
        "ref": "Ps 149"
      },
      {
        "type": "canticle",
        "scriptureRef": "1 Chr 29:10-13",
        "name": "Canticle of David"
      },
      {
        "type": "psalm",
        "ref": "Ps 150"
      }
    ]
  },
  "daytimePrayer": {
    "psalmody": [
      {
        "type": "psalm",
        "ref": "Ps 119:129-136"
      },
      {
        "type": "psalm",
        "ref": "Ps 6"
      },
      {
        "type": "psalm",
        "ref": "Ps 7"
      }
    ]
  },
  "vespers": {
    "psalmody": [
      {
        "type": "psalm",
        "ref": "Ps 1"
      },
      {
        "type": "psalm",
        "ref": "Ps 2"
      },
      {
        "type": "canticle",
        "scriptureRef": "1 Tm 3:16",
        "name": "Canticle of Timothy"
      }
    ]
  },
  "compline": {
    "psalmody": [
      {
        "type": "psalm",
        "ref": "Ps 143:1-11"
      }
    ]
  }
}
