{
  "verified": false,
  "officeOfReadings": {
    "psalmody": [
      {
        "type": "psalm",
        "ref": "Ps 86"
      },
      {
        "type": "psalm",
        "ref": "Ps 87"
      },
      {
        "type": "psalm",
        "ref": "Ps 88"
      }
    ]
  },
  "lauds": {
    "psalmody": [
      {
        "type": "psalm",
        "ref": "Ps 81"
      },
      {
        "type": "canticle",
        "scriptureRef": "Ex 15:1-13, 17-18",
        "name": "Canticle of Moses"
      },
      {
        "type": "psalm",
        "ref": "Ps 82"
      }
    ]
  },
  "daytimePrayer": {
    "psalmody": [
      {
        "type": "psalm",
        "ref": "Ps 119:25-32"
      },
      {
        "type": "psalm",
        "ref": "Ps 89"
      },
      {
        "type": "psalm",
        "ref": "Ps 90"
      }
    ]
  },
  "vespers": {
    "psalmody": [
      {
        "type": "psalm",
        "ref": "Ps 84"
      },
      {
        "type": "psalm",
        "ref": "Ps 85"
      },
      {
        "type": "canticle",
        "scriptureRef": "Eph 1:3-10",
        "name": "Canticle of Ephesians"
      }
    ]
  },
  "compline": {
    "psalmody": [
      {
        "type": "psalm",
        "ref": "Ps 16"
      }
    ]
  }
}
