{
  "verified": false,
  "officeOfReadings": {
    "psalmody": [
      {
        "type": "psalm",
        "ref": "Ps 60"
      },
      {
        "type": "psalm",
        "ref": "Ps 61"
      },
      {
        "type": "psalm",
        "ref": "Ps 62"
      }
    ]
  },
  "lauds": {
    "psalmody": [
      {
        "type": "psalm",
        "ref": "Ps 55"
      },
      {
        "type": "canticle",
        "scriptureRef": "Jdt 16:2-3, 13-15",
        "name": "Canticle of Judith"
      },
      {
        "type": "psalm",
        "ref": "Ps 56"
      }
    ]
  },
  "daytimePrayer": {
    "psalmody": [
      {
        "type": "psalm",
        "ref": "Ps 119:49-56"
      },
      {
        "type": "psalm",
        "ref": "Ps 63"
      },
      {
        "type": "psalm",
        "ref": "Ps 64"
      }
    ]
  },
  "vespers": {
    "psalmody": [
      {
        "type": "psalm",
        "ref": "Ps 57"
      },
      {
        "type": "psalm",
        "ref": "Ps 59"
      },
      {
        "type": "canticle",
        "scriptureRef": "Rv 11:17-18, 12:10-12",
        "name": "Canticle of Revelation (the Kingdom)"
      }
    ]
  },
  "compline": {
    "psalmody": [
      {
        "type": "psalm",
        "ref": "Ps 4"
      },
      {
        "type": "psalm",
        "ref": "Ps 134"
      }
    ]
  }
}
