{
  "verified": false,
  "officeOfReadings": {
    "psalmody": [
      {
        "type": "psalm",
        "ref": "Ps 39"
      },
      {
        "type": "psalm",
        "ref": "Ps 40"
      },
      {
        "type": "psalm",
        "ref": "Ps 41"
      }
    ]
  },
  "lauds": {
    "psalmody": [
      {
        "type": "psalm",
        "ref": "Ps 35"
      },
      {
        "type": "canticle",
        "scriptureRef": "1 Sm 2:1-10",
        "name": "Canticle of Hannah"
      },
      {
        "type": "psalm",
        "ref": "Ps 36"
      }
    ]
  },
  "daytimePrayer": {
    "psalmody": [
      {
        "type": "psalm",
        "ref": "Ps 119:161-168"
      },
      {
        "type": "psalm",
        "ref": "Ps 42"
      },
      {
        "type": "psalm",
        "ref": "Ps 43"
      }
    ]
  },
  "vespers": {
    "psalmody": [
      {
        "type": "psalm",
        "ref": "Ps 37"
      },
      {
        "type": "psalm",
        "ref": "Ps 38"
      },
      {
        "type": "canticle",
        "scriptureRef": "Col 1:12-20",
        "name": "Canticle of Colossians"
      }
    ]
  },
  "compline": {
    "psalmody": [
      {
        "type": "psalm",
        "ref": "Ps 4"
      },
      {
        "type": "psalm",
        "ref": "Ps 134"
      }
    ]
  }
}
