{
  "verified": false,
  "officeOfReadings": {
    "psalmody": [
      {
        "type": "psalm",
        "ref": "Ps 32"
      },
      {
        "type": "psalm",
        "ref": "Ps 33"
      },
      {
        "type": "psalm",
        "ref": "Ps 34"
      }
    ]
  },
  "lauds": {
    "psalmody": [
      {
        "type": "psalm",
        "ref": "Ps 28"
      },
      {
        "type": "canticle",
        "scriptureRef": "Is 45:15-25",
        "name": "Canticle of Isaiah"
      },
      {
        "type": "psalm",
        "ref": "Ps 29"
      }
    ]
  },
  "daytimePrayer": {
    "psalmody": [
      {
        "type": "psalm",
        "ref": "Ps 119:25-32"
      },
      {
        "type": "psalm",
        "ref": "Ps 35"
      },
      {
        "type": "psalm",
        "ref": "Ps 36"
      }
    ]
  },
  "vespers": {
    "psalmody": [
      {
        "type": "psalm",
        "ref": "Ps 30"
      },
      {
        "type": "psalm",
        "ref": "Ps 31"
      },
      {
        "type": "canticle",
        "scriptureRef": "Phil 2:6-11",
        "name": "Canticle of Philippians"
      }
    ]
  },
  "compline": {
    "psalmody": [
      {
        "type": "psalm",
        "ref": "Ps 31:1-6"
      }
    ]
  }
}
